{
  "version": 1,
  "publish": false,
  "product": {
    "source_url": "https://www.mercadolivre.com.br/adubo-fertilizante-npk-041408-1-kg-plantio-flores-e-frutos/up/MLBU4457612445?pdp_filters=seller_id%3A2705516614",
    "canonical_url": "https://www.mercadolivre.com.br/adubo-fertilizante-npk-041408-1-kg-plantio-flores-e-frutos/up/MLBU4457612445?pdp_filters=seller_id%3A2705516614",
    "title": "Adubo Fertilizante Npk 04-14-08 1 Kg Plantio Flores E Frutos",
    "item_id": "MLB7273066334",
    "image_url": "https://http2.mlstatic.com/D_Q_NP_2X_810823-MLB113931028108_072026-E--adubo-fertilizante-npk-041408-1-kg-plantio-flores-e-frutos.webp",
    "main_image_url": "https://http2.mlstatic.com/D_Q_NP_2X_810823-MLB113931028108_072026-E--adubo-fertilizante-npk-041408-1-kg-plantio-flores-e-frutos.webp",
    "gallery_images": [
      "https://http2.mlstatic.com/D_Q_NP_2X_810823-MLB113931028108_072026-E--adubo-fertilizante-npk-041408-1-kg-plantio-flores-e-frutos.webp"
    ]
  },
  "research": {
    "queries": [
      "teste cache imagem npk",
      "teste cache mercado livre"
    ],
    "candidate_terms": [
      "npk 04-14-08",
      "adubo npk",
      "fertilizante npk",
      "plantio flores frutos"
    ],
    "notes": "Job técnico publish=false para validar leitura do cache persistente de imagens do Mercado Livre sem publicar páginas reais e sem depender da rede quando houver cache hit."
  },
  "pages": [
    {
      "slug": "teste-cache-npk",
      "heading": "Teste técnico de cache NPK 04-14-08",
      "meta_description": "Teste técnico interno do cache persistente de imagens do Mercado Livre sem publicar páginas reais.",
      "intro": "Este conteúdo existe somente para validar tecnicamente o cache de imagens e não será publicado como página pública.",
      "why": "O teste verifica se o item MLB7273066334 recupera a imagem previamente armazenada no cache sem depender de consultas de rede.",
      "observe": "O campo publish está definido como false e o teste não deve criar nem alterar landing pages públicas.",
      "faq_q": "Este teste publica uma página real?",
      "faq_a": "Não. Ele apenas valida o pipeline técnico de cache e enriquecimento de imagem.",
      "search_intent": "Validar cache persistente de imagens do Mercado Livre.",
      "candidate_terms": [
        "teste cache npk"
      ]
    }
  ]
}
